title,score,id,subreddit,url,num_comments,body,created,datetime
What side should the anode and cathode be?,2,nxp48b,tDCS,https://www.reddit.com/r/tDCS/comments/nxp48b/what_side_should_the_anode_and_cathode_be/,1,Is there any reference site that could help with electrode placement and which placements have which effects on you?,1623442491.0,2021-06-11 16:14:51
Study shows that tACS is more effective than Ritalin in ADHD,24,nxkwxe,tDCS,https://www.reddit.com/r/tDCS/comments/nxkwxe/study_shows_that_tacs_is_more_effective_than/,7,"I saw this study the other day and thought it would be interesting to share and hear your thoughts about it. [https://acta.tums.ac.ir/index.php/acta/article/view/8394](https://acta.tums.ac.ir/index.php/acta/article/view/8394)  


One thing that bothers me though is that nowhere in the study does it say how many milligrams of Ritalin was used, isn't that weird? The dosage must have an immense impact be an important parameter in this?",1623431168.0,2021-06-11 13:06:08
What frequency when doing tDCS montages on tACS?,4,nwtmqt,tDCS,https://www.reddit.com/r/tDCS/comments/nwtmqt/what_frequency_when_doing_tdcs_montages_on_tacs/,6,"When reading about tDCS montages they only mention ""current stimulation"", so if I want to do the same montage with my Bumble Bee (tACS) what frequency should I use?   


I'm thinking if there is a ""standard"" frequency that usually gives the same result as the current in tDCS.",1623346941.0,2021-06-10 13:42:21
Anyone used rDCS for antidepressant withdrawal?,5,nwqbky,tDCS,https://www.reddit.com/r/tDCS/comments/nwqbky/anyone_used_rdcs_for_antidepressant_withdrawal/,0,Any thoughts?,1623338642.0,2021-06-10 11:24:02
Could tDCS help with antidepressant withdrawal?,5,nwj63o,tDCS,https://www.reddit.com/r/tDCS/comments/nwj63o/could_tdcs_help_with_antidepressant_withdrawal/,12,Any thoughts?,1623316431.0,2021-06-10 05:13:51
What are some good tDCS/tACS montages for you?,3,nw5r79,tDCS,https://www.reddit.com/r/tDCS/comments/nw5r79/what_are_some_good_tdcstacs_montages_for_you/,11,"What montages have given you some effects? For how long did you do it and what were the frequency?

I got a Bumble Bee (tACS) but I guess I can use the same montage even if people recommend tDCS montages?

Thanks",1623271192.0,2021-06-09 16:39:52
"""F10 anode / left arm cathode"" vs ""Fp1 anode / right arm cathode"" (and P3 anode / P4 cathode).",2,nvyriu,tDCS,https://www.reddit.com/r/tDCS/comments/nvyriu/f10_anode_left_arm_cathode_vs_fp1_anode_right_arm/,12,"Hello,  
I would like to use TDCS in order to increase my ability to memorize acquired knowledge and to master new skills related to math, physics and computer science.   
*Long terme memory is as importante as working memory for me.*  


I didn't start to do tDCS sessions yet because, firstly, I would like to know your opinion about:

1. What would be the best montage or montages for me?
2. How frequently should I use it or them?

I plan to use three or two montages:

1. F10 anode / left arm cathode (montage 1) at morning.
2. Fp1 anode / right arm cathode (montage 2) at noon.
3. P3 anode / P4 cathode (montage 3) at evening.

Do montages 1 and 2 conflict with each other?  
Should I use them (the 3 montages) the same day or alternate (every days or months or years) or should I jsut focus on one of them (for the rest of my life)?   


If you have any other sugestions I'll be happy to hear them.  
Thank you for reading my questions.",1623252978.0,2021-06-09 11:36:18
Tdcs as substance substitute,8,nvsmc1,tDCS,https://www.reddit.com/r/tDCS/comments/nvsmc1/tdcs_as_substance_substitute/,9,"So, I live in Russia, where we have a very strict drug laws. Even weed legalization is so far away in the future, that there is no point in looking forward to it. This obviously leads do a developed dark market for illegal substances. It is strongly connected with government and people of power benefit from restricting drugs. A huge part of all imprisoned people are there because of the drug law.
I see tdcs as a way out. T4+/t3- montage affects me in a way, which is very similar to cannabis. 
So I ask for recommendations. What montages you know, that work immediately after stimulation and have effects close to psychoactive substances?
Honestly, tripping on electricity is the most cyberpunk thing I can imagine. Especially considering that this would help fight alliance of crime and government, which use addiction to profit both in terms of money and prisons fulfilment.",1623234844.0,2021-06-09 06:34:04
Pulsed electromagnetic field therapy,5,nvitrc,tDCS,https://www.reddit.com/r/tDCS/comments/nvitrc/pulsed_electromagnetic_field_therapy/,0,"Has anyone here tried PEFT? I'm wondering if someone could please help me make a decision. I've used the alpha stim with some success, but it is quite stimulating for me so I have to use in morning and doesn't help with my sleep.

Does anyone know if these are FDA approved? I know Fisher Wallace and alpha stim are. 

I'd like to try one, but would really appreciate any advice out there on people's thoughts on the effectiveness and which model/product to buy.

https://omnipemf.com/science-behind/",1623198322.0,2021-06-08 20:25:22
Any update on lucid dream generator?,2,nvbo4l,tDCS,https://www.reddit.com/r/tDCS/comments/nvbo4l/any_update_on_lucid_dream_generator/,6,"There was one study about tDCS 40Hz generating lucid dreams, is there any update?",1623179104.0,2021-06-08 15:05:04
Brain Premier Electrodes Excessive Current Density?,2,nv7jl2,tDCS,https://www.reddit.com/r/tDCS/comments/nv7jl2/brain_premier_electrodes_excessive_current_density/,3,"The electrodes that come with it are 4cm (not including the rubber bezel) and are circular. Would this mean the current density is excessive? Im not totally sure how to work it out.

thanks",1623168150.0,2021-06-08 12:02:30
Anyone have experience with Foc.us devices?,5,nuquq3,tDCS,https://www.reddit.com/r/tDCS/comments/nuquq3/anyone_have_experience_with_focus_devices/,3,"Back in 2013 I bought their first device, the [foc.us](https://foc.us) gamer for 200 bucks. They sent me a broken unit. They sent an email saying their whole first batch of devices from the factory were not functioning right and that they will send out replacements asap. I never received a replacement. I contacted them lots of times but no success. I still attempt to get them to respond to my emails with no luck. They don't seem to have a phone number or a name of anyone associated with that that I can talk to. I still have the headset as proof. A refund would be nice, or at least a big discount from their store or store credit.",1623108901.0,2021-06-07 19:35:01
Best tdcs or ces for sport performance,2,ntzlbv,tDCS,https://www.reddit.com/r/tDCS/comments/ntzlbv/best_tdcs_or_ces_for_sport_performance/,4,,1623025370.0,2021-06-06 20:22:50
Has anyone tried using two TAC's stimulators-depression?,4,nssc5s,tDCS,https://www.reddit.com/r/tDCS/comments/nssc5s/has_anyone_tried_using_two_tacs/,6,"https://www.nature.com/articles/s41398-019-0439-0


This is the only clinical trial using TACs for depression. The treatment was 5 days and follow ups were reported at 5days, 2 weeks and 4 weeks. 
2 week depression scores were improved significantly. By 4 weeks the effect had subsided, possibly due to the fact that TACS was only administered for 5 days.

It seems they have used two stimulation devices at 1ma. They seem to have placed an anode on f3, one on f4 and two cathodes on cz. Both devices set to 1 ma, giving a total of 2ma at cz and 1 ma on both f3 and f4. 

Has anyone done this? If so can you explain methods + results?",1622886916.0,2021-06-05 05:55:16
Best settings for depression? (Bumble Bee/tACS),2,nqvqw2,tDCS,https://www.reddit.com/r/tDCS/comments/nqvqw2/best_settings_for_depression_bumble_beetacs/,22,"I just got my Bumble Bee (tACS) and got a couple of questions since I'm a complete newbie, if you can answer one or a few of them I'd be really grateful.  


1. The manual says that putting one electrode on F3 and one of F2 is best for depression, do you agree?
2. I have ear clips as well, is it even better to use them as well as the electrodes on the skull?
3. It says 8-12 hz are best, which one exactly would be most effective in your experience or in studies?
4. Is it better to use a higher current or does it not matter at all?
5. Have you had good results on this?",1622666373.0,2021-06-02 16:39:33
Possible brain damage,5,nqtmiz,tDCS,https://www.reddit.com/r/tDCS/comments/nqtmiz/possible_brain_damage/,18,"Hi

I did this excessively three years ago when i was having psychotic depression. I did it too much so i had some nerve damage on my scalp and they flare up sometimes. 

I’m fairly well these days apart from apathy. I just had a thought that what if the tdcs (3ma) damaged my prefrontal cortex and the apathy i’m still having is the result from that?

What do you say? Doctors told me afterwards my brain is fine and no damage can be caused because the current is too small to penetrate the skull or something like that. 

How the heck i can be sure it didn’t fuck me up?",1622660967.0,2021-06-02 15:09:27
Alpha Sim does it work?,1,nqs6gu,tDCS,https://www.reddit.com/r/tDCS/comments/nqs6gu/alpha_sim_does_it_work/,5,Has anyone gotten any relief from their daily anxiety by using the Alpha Sim device.  How long did it take for results? How often do you use it?. I just purchased one and with 4 days use I have yet to notice any relief.  Thanks for any advice.  My setting have ranged from 1.5-2.5.  for 20 minutes..40 minutes..60 minutes..and zip for relief. Thanks.,1622657357.0,2021-06-02 14:09:17
Montage for prefrontal stimulation and visual cortex inhibition,4,npu1k0,tDCS,https://www.reddit.com/r/tDCS/comments/npu1k0/montage_for_prefrontal_stimulation_and_visual/,3,I'm looking for a montage to stimulate visualization and episodic memory due to my inability of both. I own an apex 4ma device and am looking for a montage for anodal prefrontal and cathodal visual cortex. Any suggestions?,1622554065.0,2021-06-01 09:27:45
tACS device Bumble Bee popping up in Spain Lifestyle Mag,3,npdl6b,tDCS,https://www.reddit.com/r/tDCS/comments/npdl6b/tacs_device_bumble_bee_popping_up_in_spain/,1,"One of my favorite cranial devices, the tACS Bumble Bee Neuron Queen has recently been featured in a Spanish Health and Lifestyle magazine, along with some other tDCS devices. You can read about it here: (Google should auto translate into English if need be).

[https://hypetv.es/neuron-queen-bumble-bee-descubre-mas-ondas-cerebrales/](https://hypetv.es/neuron-queen-bumble-bee-descubre-mas-ondas-cerebrales/)

This Taiwanese invention is quietly starting to make some leaps. Good on them!",1622495770.0,2021-05-31 17:16:10
Anterior cingulate cortex 5mA extended positive stimulation results,3,np7vt3,tDCS,https://www.reddit.com/r/tDCS/comments/np7vt3/anterior_cingulate_cortex_5ma_extended_positive/,2,Using a much higher 5mA for hours at a time is incredible therapy. Delivery method determines effectiveness and not a device itself. Saline is the only safe delivery for 24 hour daily use. I use 5mA with positive large sponge on anterior cingulate cortex and negative on lower body. Helps osteoarthritis and improves all cognitive function. The positive heats up and requires a larger surface to diffuse heat. Skin burns are scientifically proven to be the only body harm of tCDS. Some people may not like the feel of the strong lasting current and stimulation effect.,1622480008.0,2021-05-31 12:53:28
"If tDCS work, do you have to use it for the rest or your life?",12,no9ir3,tDCS,https://www.reddit.com/r/tDCS/comments/no9ir3/if_tdcs_work_do_you_have_to_use_it_for_the_rest/,9,Or is it just a period of time? For those who cured their depression with it: Do you have to use it for the rest of your life?,1622375262.0,2021-05-30 07:47:42
Need some help with the Apex Device,1,no4fog,tDCS,https://www.reddit.com/r/tDCS/comments/no4fog/need_some_help_with_the_apex_device/,10,"Hey guys. So I've followed the instructions on the manual that it came with, but the problem I have is the analog meter moves when the red cable is plugged into both of the orifices in the front, but when I do the black and red cable plugged into their respective slots, the analog meter does not move at all after turning it on. I have the other end of each cable plugged into some electrodes that aren't applied to my head (just sitting on the desk), nor are they even wet with saline yet as I'm just trying to test the analog meter and make sure things are working.

I'm wondering would this also be a bad thing to try to do. Would it wear out the electrodes because there is no saline on them? Are there actually electrical currents being flown into the electrodes or unlikely due it not having any saline? I really can't tell with the analog meter not moving.

Sorry if I'm going in circles with these questions but I'm really just about to take the plunge with doing this after a long time of wondering.

Thanks!",1622353197.0,2021-05-30 01:39:57
question: tdcs using lm334,1,no20o3,tDCS,https://www.reddit.com/r/tDCS/comments/no20o3/question_tdcs_using_lm334/,1,"Hello. I want to make a tdcs with a constant current source using the lm334 but I have a question. 

What happens if the input voltage (V +) is not enough to deliver the constant current to the load. Is there no voltage passing and therefore there will be no current through the load? (I simulated a constant current source with the LM317 and when it happens that the input voltage is not enough, it simply passes less current through the load but I don't know what happens in these cases in the LM334)",1622343234.0,2021-05-29 22:53:54
Alpha stim usage per day for anxiety,3,nnz6qu,tDCS,https://www.reddit.com/r/tDCS/comments/nnz6qu/alpha_stim_usage_per_day_for_anxiety/,13,Does anyone here use the alpha stim more than once a day? I'm going through a tough time and thinking about doubling down on my usage. Once in the morning 20mins on 3.5 and an hour on 2 in the afternoons. Any thoughts?,1622332253.0,2021-05-29 19:50:53
Anyone have the flow? Which would I choose for power EU or UK?,3,nn4eim,tDCS,https://www.reddit.com/r/tDCS/comments/nn4eim/anyone_have_the_flow_which_would_i_choose_for/,11,,1622226842.0,2021-05-28 14:34:02
Less expensive replacement for Alpha stim 100,10,nlwvrs,tDCS,https://www.reddit.com/r/tDCS/comments/nlwvrs/less_expensive_replacement_for_alpha_stim_100/,42,"Hello all - I’ve been using an alpha stim for depression, anxiety and chronic pain for about 14 years off and on and my machine just bit the dust. An Alph stim- even just for anxiety, depression and insomnia-is double the price of what I originally paid.  Is there another product that works just as well but is reasonable in price? One that works better? At this point I’m mostly concerned w treating my depression and anxiety but would rather have all of the features (ability to treat pain as well as psych symptoms) if I have to purchase something new.  Thanks to all that took the time to read and answer!",1622079939.0,2021-05-26 21:45:39
Anyone have experience with the NeuroMyst pro?,9,njnzlh,tDCS,https://www.reddit.com/r/tDCS/comments/njnzlh/anyone_have_experience_with_the_neuromyst_pro/,22,I see limited feedback on it but I’m very interested in the fact that it offers both tDCS and tACS and price is reasonable at $150.,1621825110.0,2021-05-23 22:58:30
can i use ultrasound gel instead of saline solution ? ..or is it a no no !,1,njc3bb,tDCS,https://www.reddit.com/r/tDCS/comments/njc3bb/can_i_use_ultrasound_gel_instead_of_saline/,2,"hi.   
i read online that i should put a saline solution on the sponges and i wonder if they say it because  saline solution is better for TDCS than ultrasound gel ? or it is just easier to get ?",1621789754.0,2021-05-23 13:09:14
Effects of TDCS for depression & anxiety,14,ni3zqt,tDCS,https://www.reddit.com/r/tDCS/comments/ni3zqt/effects_of_tdcs_for_depression_anxiety/,30,"I’m considering trying TDCS for depression and anxiety. I have searched this forum for experiences and read through what I was able to find, with many posts being years old.

I have a few questions:

1) Have you tried TDCS for anxiety and/or depression? What montage and frequency of sessions did you use? Has this been effective for you? What side effects have you experienced?

2) Based on past posts—have you experienced trouble with word recall after using TDCS? How has this presented? Do you feel it decreases your cognitive abilities during conversation, studying, or any other day-to-day activities?

3) How has TDCS treatment affected your ability to focus, learn, remember, and retain information (or not)? I realize that an improvement in depression and/or anxiety symptoms would also affect this.

Thanks!",1621634341.0,2021-05-21 17:59:01
Do companies need to go through proper testing to be able to sell their product due to it using electricity to stimulate the brain?,4,nfq1g5,tDCS,https://www.reddit.com/r/tDCS/comments/nfq1g5/do_companies_need_to_go_through_proper_testing_to/,9,What's the rules and regulations stopping anyone from just making any old tdcs device and selling it?,1621381647.0,2021-05-18 19:47:27
Trying to use brain driver on tongue but keeps zapping and shorting,3,ne00cq,tDCS,https://www.reddit.com/r/tDCS/comments/ne00cq/trying_to_use_brain_driver_on_tongue_but_keeps/,9,What am I doing wrong? It works when I put it up to my forehead but when I put it on my tongue it just shocks me and then stops working. Any way to troubleshoot this or way to get it to work?,1621204938.0,2021-05-16 18:42:18
Selling in Australia vic Melbourne 3155 these sorry if not allowed,5,nddodr,tDCS,https://www.gumtree.com.au/s-ad/boronia/miscellaneous-goods/ssd-tdcs-deluxe-model-transcranial-direct-current-stimulation-from-usa/1274282450?utm_campaign=socialbuttons&utm_content=ios_sVIP&utm_medium=social&utm_source=com.apple.uikit.activity.copytopasteboard,3,,1621129250.0,2021-05-15 21:40:50
Alternative to fp2 and f3,1,ncz6bf,tDCS,https://www.reddit.com/r/tDCS/comments/ncz6bf/alternative_to_fp2_and_f3/,2,I was wondering if fp1 and f4 does the same thing as fp2 and f3; because when I consistently place it on the same spot my bones kinda hurt,1621086176.0,2021-05-15 09:42:56
New activadose II user,1,ncexhy,tDCS,https://www.reddit.com/r/tDCS/comments/ncexhy/new_activadose_ii_user/,0,Is there a good series of intro videos on how to start using it?  Thank you,1621015505.0,2021-05-14 14:05:05
Aktivate tDCS Device when in REM,5,nbn92m,tDCS,https://www.reddit.com/r/tDCS/comments/nbn92m/aktivate_tdcs_device_when_in_rem/,6,"Hey guys, I didn't really find much on Google about how to make a Switch with an EEG which switches when a REM phase is detected, so that it can turn on a tACS/tDCS. So I wanted to ask you if you would have any Ideas on how to code it with an Arduino for example.",1620929620.0,2021-05-13 14:13:40
Question about saline solution,2,nalja3,tDCS,https://www.reddit.com/r/tDCS/comments/nalja3/question_about_saline_solution/,3,I bought the 0.9% sodium chloride solution from Caputron about a year ago and haven't used it yet. Just broke the seal off today and have opened it but was wondering if there's a recommended way to store it. Would I have to put it in the fridge or would leaving it out in room temperature be just fine? It's still in its original bottle. The expiration date on the bottle says 12/22 so I'm guessing it should still be good enough until then? Thanks!,1620815572.0,2021-05-12 06:32:52
Anecdotal report of several montages with Apex Type A 18V 4ma device over the course of two weeks.,6,n9xr0x,tDCS,https://www.reddit.com/r/tDCS/comments/n9xr0x/anecdotal_report_of_several_montages_with_apex/,13,"I have been using this for almost two weeks now and I have received mixed results. Given the benefit of some montages, however, I will keep using this device and see what long-term outcomes I have. 

I purchased the 4ma device as a stronger alternative to 2ma, although it is my first device ever that I have purchased. The reason I bought this particular brand is because of safety. 

The Apex device has sponge connectors instead of the regular electrode ones. It minimizes skin burning and is easy to set up. Just make some saline with some non-iodized salt and pour it on both sponges. 

The device is also strictly battery powered, requiring the use of 2 9V batteries. The device also has an analog connection so the meter should always show you exactly how much current you are introducing. That being said, the anodal connector tends to corrode much faster than the cathodal one, which requires routine cleaning depending on how much you use it. Pretty easy to set up overall. 

The device itself is totally safe, as I have experimented with using it twice a day for 30 minutes per session and have little to no side effects. It takes 10ma current to kill you and 4ma is well below the threshold where you would be injured by the electric current. 

When I do feel side effects it really depends on the montage. Sometimes I have a mild headache, sometimes I feel dizzy, sometimes I get a tick and in one instance I actually felt nauseous but that's because I placed the anodal connector on the wrong part.

In my experience you need to pay close attention to where exactly you are placing the connectors as you may accidentally stimulate other parts of the brain and get different results and side effects.

Now let's move on to the montages listed here: https://apexdevice.net/

- Depression/anxiety, insomnia montage: This was my first montage and it was the reason why I purchased this device. I say it definitely works. It works *too* well, actually since I get transported in this state of bliss for several hours where I turn into a Buddha-like mentality where I feel like living in harmony with people, etc. I would feel totally relaxed, sleep better and live in the moment. It does make me kinda lazy, however since I would get so laid back.

I also need to use the device twice a day to make sure the effects last all day, several hours apart, although I have experimented with 20 minutes apart instead but several hours apart is good enough. I was under the impression that this would cause long-term potentiation and provide a permanent change to my mood but it has only proven to be temporary so far so I have moved on to other montages out of curiosity.

Junk food/Alcohol Cravings montage - No immediate effect although the intention was to use it for porn addiction, not food and alcohol. I had assumed the same pathways for food and alcohol cravings would be triggered under porn addiction but that may not seem to be the case. However I won't explore it further because it seems like a waste of time.

- Insightfulness/Creativity - No effect at all.

- Accelerated learning - This works for a few hours although I've only done it once. There is definitely increased focus on a given task but it feels like you're on adderall. You would have to do two sessions spread over several hours apart to have an all-day effect.

- Focus - This one had the most impact although I only started doing it yesterday. This removed the usual sluggishness I have and I got stuff done big time. I work from home but it is slow so I decided to make multiple phone calls and arrangements in anticipation of my address change next month and on top of that I actually cleaned the toilet, which is something I am too lazy to do. Now it is spotless. 

I also completed my phone calls at work with a lot more insight and focus and a more well-rounded resolution in each and every call so I became much more productive overall.

Then I tested things out further by playing Fire Emblem: The Sacred Stones. Amazing game, btw. Yesterday I thoroughly plotted out each move with utmost focus and caution, examining the pros and cons of each decision and planning all the way to the end in each chapter and carefully deciding what role each of my unit plays, down to the very details of my unit's stats vs the enemy's stats, how much damage is acceptable to take in order to complete my objectives, and what are the odds of success in each maneuver. 

I was amazed at how I would keep all of my units united and carefully advanced their positions on the map. Then when I went to sleep I was hooked, thinking of alternative strategies to devise in my sleep. Man I was hooked. 

In conclusion: The device works for some montages but not others but it is safe. I will continue to try different montages over time, such as the socialization montage, but don't expect this to be a magic pill that will solve all your mental problems. You still have to keep carefully applying this device every day.",1620741877.0,2021-05-11 10:04:37
What Montage for Improving Programming Skills?,10,n8t45e,tDCS,https://www.reddit.com/r/tDCS/comments/n8t45e/what_montage_for_improving_programming_skills/,10,"I'm in college right now studying computer science, and next semester is the big data structures and algorithms class. I'm looking forward to it but also expect it to be challenging.

I did tDCS a couple years ago to improve my mood, and I noticed that it definitely helped. I'll be doing a lot of algorithm analysis, memorizing data structures and stuff - I was wondering what montages might be recommended for improving my coding ability? What might facilitate this mix of math and logical thinking needed for success in programming?",1620612018.0,2021-05-09 22:00:18
What is best tDCS device for a beginner?,4,n8548s,tDCS,https://www.reddit.com/r/tDCS/comments/n8548s/what_is_best_tdcs_device_for_a_beginner/,13,"What is best tDCS device for a beginner? for potential long term use and  no need for upgrades. 

Money is not a concern.",1620529877.0,2021-05-08 23:11:17
