title,score,id,subreddit,url,num_comments,body,created,datetime
Increased anxiety after tDCS (Flow),5,lo6ig5,tDCS,https://www.reddit.com/r/tDCS/comments/lo6ig5/increased_anxiety_after_tdcs_flow/,3,"Hello, just wondering if anyone has had similar issues to me and whether it is worth continuing with treatment as a result?

Basically, I've done two 30 minute tDCS sessions with the Flow Neuroscience tDCS kit. I decided to try it out for a number of reasons - I have anhedonia and lack of motivation, and also some other conditions (OCD, anxiety, some quasi-akathisia, visual snow) many of which are iatrogenic in nature (SSRI withdrawal, and past alcohol usage certainly didn't help) which I'd hoped could also improve with treatment.

Two days ago I did my first session and experienced an increase in physiological anxiety, but this was tolerable. But then after doing the 30 minute session last night, I experienced an intense feeling of panic, fear and restlessness, coupled with a significant increase in my OCD thoughts and the feeling that I might 'lose control'. This persisted through the night and it's still here just now, albeit slightly better than it was. 

Has anyone experienced similar reactions to this treatment and is this reaction a sign I should stop it?",1613825441.0,2021-02-20 07:50:41
Alpha stim feeling super amped,3,lmw2s0,tDCS,https://www.reddit.com/r/tDCS/comments/lmw2s0/alpha_stim_feeling_super_amped/,6,"I've had success with the alpha stim for anxiety, but find if it's too low it does nothing, too high and I feel better, but super amped with too much energy and a heavy feeling in my head.",1613679335.0,2021-02-18 15:15:35
Hey guys what’s good to buy for tomorrow?,0,lm7vw4,tDCS,https://www.reddit.com/r/tDCS/comments/lm7vw4/hey_guys_whats_good_to_buy_for_tomorrow/,2,,1613604607.0,2021-02-17 18:30:07
Hi . New here!,3,llq88c,tDCS,https://www.reddit.com/r/tDCS/comments/llq88c/hi_new_here/,2,"Have just heard about it.
Could someone point me to how to make a tdcs device correctly and not paying 500 eur for FLOW

Maybe , could we pin all the good advices?
Common people lets make a pinned message for all the noobies",1613552570.0,2021-02-17 04:02:50
Feedback for LIFTiD or Brain Driver?,3,llb6mh,tDCS,https://www.reddit.com/r/tDCS/comments/llb6mh/feedback_for_liftid_or_brain_driver/,9,I’m super interested in trying tDCS to see if it helps my ADHD & anxiety. Budget is somewhat tight so I’m looking at the more affordable models. Does anyone have any experience with these? I’ve been hearing a lot about montages but don’t know what they are exactly. Hoping these models would have a montage useful for ADHD or anxiety.,1613502810.0,2021-02-16 14:13:30
tDCS with ADHD?,9,ll621j,tDCS,https://www.reddit.com/r/tDCS/comments/ll621j/tdcs_with_adhd/,8,Has anyone with ADHD had long term success with tDCS? Is this something that has to be done without medication or do can people use this therapy while on Wellbutrin?,1613489008.0,2021-02-16 10:23:28
This all reminds me of the brain booster from Forbidden Planet,21,ljmmpm,tDCS,http://www.e357.net/beingernest/wp-content/uploads/2014/03/Brain_Booster_Forbidden_Planet_1956.png,2,,1613301392.0,2021-02-14 06:16:32
Just bought the braindriver looking for suggestions,2,ljjdov,tDCS,https://www.reddit.com/r/tDCS/comments/ljjdov/just_bought_the_braindriver_looking_for/,9,"Hey everyone I’ve been majorly depressed for the better part of 20 years off and on. I have been diagnosed with bipolar depression. 

I am seemingly medication resistant and have been recommended by doctors to do ECT, but I’m kinda scared. I found this tDCS product the other day and decided to try it out first. 

I’m brand new to the world of tDCS and hope to have good results.

Could anyone point me in the right direction to start learning more about the placements for depression/bipolar/anxiety/ mood disorder montages? 

Can I do more than one treatment a day? Like one for depression, and one for exercise, or concentration? Should I only do one a day? Every other day?? I have no idea!!

Please give me any advice you think I could use, and maybe some stories of success and encouragement.

Thanks!",1613285199.0,2021-02-14 01:46:39
Has anyone with Bi Polar 2 had success with tDCS depressive episodes?,11,lfteo5,tDCS,https://www.reddit.com/r/tDCS/comments/lfteo5/has_anyone_with_bi_polar_2_had_success_with_tdcs/,0,,1612840940.0,2021-02-08 22:22:20
Question,0,ldympr,tDCS,https://www.reddit.com/r/tDCS/comments/ldympr/question/,4,Where comes the cathode and where the anode? In which part? Can you help me please,1612621677.0,2021-02-06 09:27:57
Effect of Repeated Anodal HD-tDCS on Executive Functions: Evidence From a Pilot and Single-Blinded fNIRS Study,16,ldtqpt,tDCS,https://pubmed.ncbi.nlm.nih.gov/33536886/,1,,1612602913.0,2021-02-06 04:15:13
Flow acquires brain stimulation technology developer Halo,9,ldk2h6,tDCS,https://www.medicaldevice-network.com/news/flow-stimulation-technology-halo/,6,,1612566883.0,2021-02-05 18:14:43
best tDCS,2,lc6w4t,tDCS,https://www.reddit.com/r/tDCS/comments/lc6w4t/best_tdcs/,8,Hi! What's the best tDCS to buy to help me build new neural networks faster?,1612410987.0,2021-02-03 22:56:27
Caputron ActivaDose II Issue and Question,0,lc50r0,tDCS,https://www.reddit.com/r/tDCS/comments/lc50r0/caputron_activadose_ii_issue_and_question/,2,"So I’m not sure if this is the right sub to ask this question but I figured someone might be able to offer some advice. 

I purchased the ActivaDose II by Caputron not that long ago (2months?) 

I’ve only tested out two montage positions that I found on the totaltdcs website. 

- The “Depression and Anxiety” montage where the anode is placed on the left DLPFC (F3) and cathode on right supraorbital (FP2)

- The “DARPA” montage where the anode is placed on right temple and cathode place on left should/forearm

I have used the former much more than the latter as I really haven’t seen much benefit from the DARPA montage. 

Anyway, this device is suppose to be able to support up to 4.0 mA which it did in the beginning. I personally found 4.0 mA to be too uncomfortable as it had a itchy burning sensation. 

My dose experiments where 1.5/2.0/2.5/3.0/3.5 mA when using the Depression and Anxiety montage. 

I’ve noticed some benefits - namely a sense of calm and relaxation - although oddly that was more noticeable with the DARPA montage. 

Well here is the problem I have encountered - all of sudden the device no longer can go above 2.5 mA; if I attempt to have it go to 2.6mA+ a noticeable electrical current pulses and the devices safety mechanism shuts it down. 

It’s annoying but atleast I am still able to use it and honestly I don’t know if there is actually any benefit from using high mA. But does anyone know what could be causing this? I have a feeling it’s related to the battery but I honestly have no clue. 

My other question is a little different - for those that aren’t familiar with this device it’s electrodes are these neat sponge inserts that require saline solution. I originally purchased the 3x3 one because I thought that might be easier since I was a novice with this technology. 

Having had ECT before I remember that my doctors used these adhesive gel electrodes - I don’t know much about the difference between the electrode types but I believe I have read they are much more accurate in terms of precise location and current dosage. 

Now I’m obviously not trying to do at home ECT - but my question for this community is whether it’s possible to use similar electrodes with my device in lieu of the sponge/saline ones that comes standard? If it is possible does anyone have a source to get medical grade gel adhesive electrodes?",1612405152.0,2021-02-03 21:19:12
Device for inducing euphoria via vagus nerve stimulation,15,lambeu,tDCS,https://www.reddit.com/r/tDCS/comments/lambeu/device_for_inducing_euphoria_via_vagus_nerve/,10,"Hi,
I was searching about vagus nerve stimulation and found this very interesting patent which claims to have invented a device which is able to induce euphoria via non invasive magnetic stimulation of the vagus nerve:

https://patents.google.com/patent/US20110190569A1/en

Unfortunately the company seems to never realised this idea. So my question here is why not?
Is it technically not possible yet?
There are no discussions I have found about this device, so I would appreciate to hear some opinions about it.",1612236540.0,2021-02-01 22:29:00
tDCS and tACS for depression: your experience and your advice,13,l99ncg,tDCS,https://www.reddit.com/r/tDCS/comments/l99ncg/tdcs_and_tacs_for_depression_your_experience_and/,19,"Hi All!
I have just started tDCS for depression this week using the Flow Neuroscience device. So far no results for me but it's early I guess.
I wanted to know how many sessions you had before getting results for depression. I would also be interested in knowing which machine you use and if you recommend it.
If anyone has tried also tACS it would be great to know whether she/he found it useful for depression.
Any advice on frequency of sessions and other aspects of the treatment would be great to hear.
With Flow actually the treatment is not flexible but I am considering buying another machine to set intensity and frequency how I like if I feel that it works.",1612088289.0,2021-01-31 05:18:09
Bumblebee,8,l78z1t,tDCS,https://www.reddit.com/r/tDCS/comments/l78z1t/bumblebee/,16,"Good night people! i am interested in purchasing the ces bumblebee device which is a tACS, i have defict attention and anxiety, would it be recommended!? and what are your experiences with tCAS devices !? Thanks!",1611868272.0,2021-01-28 16:11:12
How can we use tdcs in treatment professionally?,4,l6d4ao,tDCS,https://www.reddit.com/r/tDCS/comments/l6d4ao/how_can_we_use_tdcs_in_treatment_professionally/,15,"Hello,

I am doing my PhD in clinical psychology. In my study, we use tdcs in the laboratory but for the experiments, not for the treatment of mental illness.

My question is that is it used in the clinics by clinical psychologists? Do we need a licence like psychological therapies? For therapies, you have to be licenced by APA (if in the US) or other international organizations depending on the method like Beck Institute.",1611777987.0,2021-01-27 15:06:27
Holy shit it works,38,l4ad46,tDCS,https://www.reddit.com/r/tDCS/comments/l4ad46/holy_shit_it_works/,30,"Hey all, I just got an Activadose today. For the last week I've been monitoring my brainwave activity during various activities using an EEG headband called Flowtime. (Very interesting, detailed feedback, would highly recommend.) I'm ADD, and one thing researchers have found is that ADD and ADHD folks have an excess of Theta brainwaves, which are normally reserved for very relaxed, daydreamy meditative states. Sure enough my Flowtime headband reflects this frustratingly consistently. My Theta waves rival my Beta waves (dominant waking waves in normal people) almost all the time and sometimes even surpass them. The one and only thing that's been able to consistently bring my Beta and Gamma above my Theta are long stretches of time playing really intense video games where my focus is demanded.

Today I tried TDCS for the first time using the DARPA montage for ADHD and attention at 2mA for 20min. After my session was over I measured my brainwaves again. Beta steadily climbed WAY above Theta for a good 15min afterward even though I was doing literally nothing. Even got my Gamma above Theta a bit. Theta also kept falling during the same time. 

I don't consciously feel any different, but holy shit. Unless there's just some residual static left over in my skin throwing off the EEG and giving me false results, it seems like TDCS actually worked? And even kept improving after the session was over? If this isn't a fluke, this is revolutionary and I'm going to be using it every day. 😂",1611530503.0,2021-01-24 18:21:43
Oasis Pro CES Device,3,l2ky09,tDCS,https://www.reddit.com/r/tDCS/comments/l2ky09/oasis_pro_ces_device/,6,Is the Oasis Pro CES Device worth the extra cost for a beginner in tDCS and CES?,1611310983.0,2021-01-22 05:23:03
TDCS for cravings,2,l2is69,tDCS,https://www.reddit.com/r/tDCS/comments/l2is69/tdcs_for_cravings/,7,Has anyone experimented with TDCS as a way to curb cravings ? I am thinking of starting up and positioning it as a product to help drug addicts and smoking cigarettes. Any feedback would be helpful. ,1611300989.0,2021-01-22 02:36:29
Best device recommendation for studying and learning,8,l1dr2f,tDCS,https://www.reddit.com/r/tDCS/comments/l1dr2f/best_device_recommendation_for_studying_and/,3,,1611163484.0,2021-01-20 12:24:44
Focus v2(or v3) VS Oasis CES device. Which one is better?,6,l0pb28,tDCS,https://www.reddit.com/r/tDCS/comments/l0pb28/focus_v2or_v3_vs_oasis_ces_device_which_one_is/,8,,1611079329.0,2021-01-19 13:02:09
Montage for emotional numbness and anhedonia?,8,kzl07z,tDCS,https://www.reddit.com/r/tDCS/comments/kzl07z/montage_for_emotional_numbness_and_anhedonia/,6,"I’ve had only used the depression montage but what I have is emotional numbness and anhedonia, I don’t feel sadness nor any feeling so I want to activate my receptors/neurons that are implicated in emotions. I don’t know if inhibiting the right side in the depression montage is useful for me because I just want to feel any emotion including anxiety. I’ve been emotionless for so long and I need my emotions back. Which montage could help for this?",1610936828.0,2021-01-17 21:27:08
Is there subreddit for CES Devices?,5,kyezfd,tDCS,https://www.reddit.com/r/tDCS/comments/kyezfd/is_there_subreddit_for_ces_devices/,2,,1610784484.0,2021-01-16 03:08:04
Electrode placement,5,kycetw,tDCS,https://www.reddit.com/r/tDCS/comments/kycetw/electrode_placement/,3,I’ve looked at the montages and I’m wondering if there exists a skull cap that assists in electrode placement (under the cap) or something of the sort. Any pointers?,1610773202.0,2021-01-16 00:00:02
"Favorite montages prior to socializing? For ADD, focus, alertness, reducing",1,ky9zlo,tDCS,https://www.reddit.com/r/tDCS/comments/ky9zlo/favorite_montages_prior_to_socializing_for_add/,1,"Info using montages w TDCS & CES/tACS are both appreciated. Especially methods most people have never heard of.

Curious what results you guys are getting w different montages, especially montages that u have created urself or aren’t well known.

Ive used a TDCS for years, just started Using a CES w some TDCS montages and curious about the possibilities there as well.

Also, curious if anyone has tried combining DARPA F10 w F3 or F1 using a CES/tACS? 

Any information on other montages u have discovered is appreciated as well. Looking forward to learning more from u guys",1610764212.0,2021-01-15 21:30:12
NEED ADVICE with DARPA Montage and learning + other tDCS question,5,kwxn5m,tDCS,https://www.reddit.com/r/tDCS/comments/kwxn5m/need_advice_with_darpa_montage_and_learning_other/,6,"Am I suppose to be studying (learning) while the DARPA tDCS montage is active? I cannot for the life of me figure out if I should be doing it before, during, after or while sleeping. 

What are the negative or positive effects could I expect using higher amps/time; say 2.5ma for 1 hour instead of 2ma for 30min? 

I really need to know when I should be using it.

Also can you use multiple montages in one day for different purposes i.e. sleep?",1610596167.0,2021-01-13 22:49:27
DARPA Montage directions,2,kwu0t9,tDCS,https://www.reddit.com/r/tDCS/comments/kwu0t9/darpa_montage_directions/,5,"I purchased the 4ma ActivaDose tDCS starter kit a while ago to help with various neuropsychological issues. 

My depression is much better except for issues with motivation. My anxiety and OCD got slightly better with the reduction OCD symptoms being far more noticeable. 

I tried using the DARPA montage to study for my LSAT but didn’t notice any improvement. 

While I have know where to place the electrodes I cannot seem to figure out WHEN I am suppose to have my sessions. 

Should my sessions be before/during or after my studying? 

I read a research article somewhere that said participants had their sessions while asleep and that their memory and focus was drastically improved. 

So if anyone could share the correct usage of the DARPA Montage that would be great. I only have a few days till my exam so I’m not expecting a miracle but figured it couldn’t hurt. 

Thanks :)",1610583938.0,2021-01-13 19:25:38
"Excellent Introduction Video to tDCS, tCES and tRNS",10,kwn5jk,tDCS,https://www.reddit.com/r/tDCS/comments/kwn5jk/excellent_introduction_video_to_tdcs_tces_and_trns/,0,"This is a lecture by Dr. Aaron Newmann at Dalhousie University in Canada. It provides some of the differences between the various transcranial brain stimulation methods and mentions some notable papers. It's just at the right duration and knowledge level for most people outside the fields of neuroscience and such.

&#x200B;

Reference Link: [https://www.youtube.com/watch?v=xvsE6hmibBQ](https://www.youtube.com/watch?v=xvsE6hmibBQ)",1610564159.0,2021-01-13 13:55:59
Adaptations to artificially induced excitability?,2,kwi5s3,tDCS,https://www.reddit.com/r/tDCS/comments/kwi5s3/adaptations_to_artificially_induced_excitability/,6,"So anodal stimulation works by generally depolarizing neurons and causing the state potential to rise towards the threshold potential. Generally, information from the visual cortex is relayed to the temporal and parietal cortices. Are there are any mechanisms in the brain that can ""identify"" both the fact that the visual cortex has not relayed certain bits of info to the temporal and parietal cortices, and the fact that many neurons in such cortices which would not normally fire action potentials do fire, given the comparatively low activity in the visual cortex, and cause adaptations that may potentially make neurons in the parietal and temporal lobes less likely to fire under normal conditions? Or anything like that? Sry if this is stupid question I'm just curious and I'm not well read in neuroscience.",1610550247.0,2021-01-13 10:04:07
Sleepiness after session,8,kw5ihm,tDCS,https://www.reddit.com/r/tDCS/comments/kw5ihm/sleepiness_after_session/,11,"Hello. I’m brand new to this and am using the device (the brain driver) to treat my MDD. I used it last night at the lowest setting for 20 minutes and my brain felt like jello and I slept for 11 hours. Then I used it this morning, felt euphoric for about an hour then fell asleep again. I’ve been trying to find out if this is common but it doesn’t seem to be so thought I’d post here to see if anyone else has had this happen. Thanks!",1610500276.0,2021-01-12 20:11:16
"Cognitive enhancement, accelerated learning experiences",4,kv5acz,tDCS,https://www.reddit.com/r/tDCS/comments/kv5acz/cognitive_enhancement_accelerated_learning/,11,"Is there anybody who has some experience (positive or negative) with tDCS with learning in the longer term ( months, years) ?

Here we are more than 13000 people and I didn’t see any answers for this question.
I’m starting to think that tDCS not really beneficial to healthy people in any way.",1610380316.0,2021-01-11 10:51:56
New to tdcs. I want to start treating my adhd. Is this better than neurofeedback?,8,ku4vja,tDCS,https://www.reddit.com/r/tDCS/comments/ku4vja/new_to_tdcs_i_want_to_start_treating_my_adhd_is/,12,Any recommended brands?,1610243977.0,2021-01-09 20:59:37
Just Purchased Fisher-Wallace Stim Device- Advice Needed (Insomnia and recent MDD),10,kt8ym4,tDCS,https://www.reddit.com/r/tDCS/comments/kt8ym4/just_purchased_fisherwallace_stim_device_advice/,3,"Hi everyone. A few months ago I got diagnosed with MDD which the dr said could very well have been a new development. I have struggled with situational depression but after a few car accidents and the pandemic there was no end to most recent bout.  I have been on Trintillex for two months and it’s, ok. I no longer have my low
Lows but it hasn’t helped with executive functioning and my appetite is out of control. I used to take Wellbutrin because a therapist told me everyone should be on an antidepressant and I thought it would help with adhd. It made me a robot. 

I have had insomnia for two decades and a long term use of sleeping pills (right now moving between belsomra and Lunesta due to insurance issues). I have tried to get off sleeping pills but I just won’t sleep- even on keto and with exercise.
I’ve also added a low grade muscle relaxer to my nighttime regime due to my recent car wrecks and melatonin.

I am not anti medication but would prefer an alternative if possible. Can this work for me? I know YMMV and there’s no such thing as a magic bullet but would love to hear what to expect if anyone has had similar diagnoses.",1610131982.0,2021-01-08 13:53:02
Best place I could think to ask this: how do I know if I’m getting any benefit from the Alpha-Stim AID?,9,kpdf0c,tDCS,https://www.reddit.com/r/tDCS/comments/kpdf0c/best_place_i_could_think_to_ask_this_how_do_i/,9,"I’m currently renting a device from a therapist for $100/mo, and there’s a $1500 fee if this thing incurs any damage so I’m hoping to get this thing out of my damn house as soon as possible before a dog gets it or the earclips start looking any worse than they did when they got to me. I was planning on asking for my own prescription after my time is up, but I’m reconsidering. The month is almost over and I have no idea if it’s working. I’ve tried writing down my daily moods but it’s a hard thing to track and harder still to know if mood shifts are due to the device or just my environment. 

My vertigo tolerance with this thing is pretty low so I have been using it under 2.5gH for 40 minutes at a time. Some people say they feel immediate relief when they use it but this is not the case for me, it’s either dizziness or nothing at all, save for the ear taps which sometimes I feel and sometimes I don’t. I know the effects are cumulative and with using it at such a low setting I wonder if effects are going to take a while to notice. How long should I give this a chance for? How can I tell if it’s helping me or not?",1609647304.0,2021-01-02 23:15:04
"TDCS 100% works for me, but the electrodes are SO UNBEARABLY ITCHY",6,koijr6,tDCS,https://www.reddit.com/r/tDCS/comments/koijr6/tdcs_100_works_for_me_but_the_electrodes_are_so/,11,"It’s a feeling that varies in intensity with every montage, but holy shit I want to get rid of it. I experience the benefits after my session, but during it? It feels like I’m on the starting screen of Black Ops 1. It feels like I’m on the receiving end of light electro-shock torture in order to divulge sensitive information to a shady government organization. How do I make this stop?!!!! Do I add more salt to the saline solution??",1609533411.0,2021-01-01 15:36:51
"""Original"" Alpha Stim vs AID and M model",6,knzf17,tDCS,https://www.reddit.com/r/tDCS/comments/knzf17/original_alpha_stim_vs_aid_and_m_model/,4,"I was looking into trying Fisher Wallace, but decided to check out what other Stim devices were out there. I saw Alpha Stim is selling its M and AID models, but they are so expensive. I found several places online selling ""The Original Alpha Stim CES"" for less than $200. Has anyone tried this one out?

 https://wandasupply.com/products/the-original-ces-alpha-stim-therapy-device",1609453412.0,2020-12-31 17:23:32
Ear clips,3,kns354,tDCS,https://www.reddit.com/r/tDCS/comments/kns354/ear_clips/,0,Has anyone substituted ear clips for the electrodes?,1609429086.0,2020-12-31 10:38:06
What are ur Favorite Montages for TDCS & tACS/CES?,3,knl8ap,tDCS,https://www.reddit.com/r/tDCS/comments/knl8ap/what_are_ur_favorite_montages_for_tdcs_tacsces/,28,"I’m curious what setups other bio hackers, people self medicating Etc are using, why, and their results.

Seems some of the best ones, aren’t as well known.

I like DARPA F10 & deltoid w TDCS 3.5-4ma’s to wake up in the AM, & increase energy, focus & learning speed 

Prefer around  FP1, F3 or FC5, with the other electrode on OZ or O2 with a CES.

It’s variations of F1 anode & OZ cathode (alternative depression montage) and really helps w stress and keeping a positive mindset",1609398411.0,2020-12-31 02:06:51
Professional administration of tDCS,7,kn7cvs,tDCS,https://www.reddit.com/r/tDCS/comments/kn7cvs/professional_administration_of_tdcs/,2,"Those of you who have had tDCS administrated in a ""professional"" environment, what were the credentials of the individual? I.e psychiatrist, psychologist, licensed therapist, etc?",1609351858.0,2020-12-30 13:10:58
tDCS simulator,8,kn4470,tDCS,https://www.reddit.com/r/tDCS/comments/kn4470/tdcs_simulator/,0,"Is there an active online tDCS ""simulator"" that helps tie together the flow of the electric current based upon montage input? Searching this subreddit I found one, but its offline. 

Thanks:)",1609341752.0,2020-12-30 10:22:32
How are you physically holding the electrodes onto your head?,2,kmywjb,tDCS,https://www.reddit.com/r/tDCS/comments/kmywjb/how_are_you_physically_holding_the_electrodes/,4,"Hello fine ladies and gentlemen! I plan on getting the Brain Driver 2.1 in order to try and get better at playing drums. I'm an almost pro-level drummer looking for something to help me get over the hump and get great at my instrument. If I understand correctly, my ideal placement would be C3 - Fp1. 

My question is: How to I physically hold the electrodes onto my head to keep them from falling off? Is there a special type of headband or securement device that everyone uses? Are you just taping the thing onto your head and accidental head-waxing be damned? 

Any help would be GREATLY appreciated!",1609319124.0,2020-12-30 04:05:24
