title,score,id,subreddit,url,num_comments,body,created,datetime
PARTICIPANTS WANTED: DIY tDCS Research Study (A few more slots open),8,pki3xa,tDCS,https://www.reddit.com/r/tDCS/comments/pki3xa/participants_wanted_diy_tdcs_research_study_a_few/,2,"First off, I'd like to extend thanks to those who have agreed to participate in my research so far. Everyone I have already spoken with has said that the interview was a really interesting experience.

I am a doctoral candidate in clinical  psychology at Duquesne University writing my dissertation on attitudes towards cognitive enhancement and the experiences of individuals who use  do-it-yourself transcranial direct current stimulation (tDCS). I am looking for individuals who would be interested in participating in an  approximately 60 minute interview via Skype or Zoom for the purposes of a  qualitative research study. The interview will focus on the personal  meanings and contexts surrounding your use of these devices, as well as  how it influences the way that you understand yourself and the world  around you.In order to participate, you must be at least 18 years old  and must own a tDCS device that is either self-built or purchased from a  direct-to-consumer manufacturer. For more information, send me a  message on here or contact...

Erick Guzman, M.A.  
Doctoral Candidate – Clinical Psychology  
Duquesne University  
[guzmane@duq.edu](mailto:guzmane@duq.edu)",1631131390.0,2021-09-08 16:03:10
New to brain stimulation - should I be looking for a TENS or Pemf or Tdcs device?,3,pkb22s,tDCS,https://www.reddit.com/r/tDCS/comments/pkb22s/new_to_brain_stimulation_should_i_be_looking_for/,6,,1631109554.0,2021-09-08 09:59:14
On a scale of 1-10 how trustworthy this kit from Lithuania?,6,pjepys,tDCS,https://i.redd.it/de79541j00m71.png,8,,1630984419.0,2021-09-06 23:13:39
Does anyone have a homemade tDCS they aren't using?,1,pjc8bm,tDCS,https://www.reddit.com/r/tDCS/comments/pjc8bm/does_anyone_have_a_homemade_tdcs_they_arent_using/,6,As cheap tDCS devices aren't really a thing I thought I would fish to see if any of you have a homemade rig you'd be willing to part with for a reasonable price.,1630975026.0,2021-09-06 20:37:06
"tDCS DIY guidelines for Tics, ADD, OCD and hypersomnia/insomnia",4,phmtj1,tDCS,https://www.reddit.com/r/tDCS/comments/phmtj1/tdcs_diy_guidelines_for_tics_add_ocd_and/,4,"  

Hi there 

I bought the brain premier device. I want to use it to help with my tics. I am an adult (31 years old) who recently developed tics (less than a year): blurting out sounds or words I'm thinking of just when I'm sleepy. I also have OCD, both drowsiness and insomnia and finally potentially ADHD.

Are there any guidelines or resources and how long should the session be and where should the electrode be applied for those conditions?",1630739223.0,2021-09-04 03:07:03
TENS unit,6,phm9n7,tDCS,https://www.reddit.com/r/tDCS/comments/phm9n7/tens_unit/,2,"Hey. Sorry I couldn't find a subreddit for TENS units. I'm looking for a TENS unit that has clips which can clip on to the ear, or has some other way of stimulating the vagus nerve. Amazon would be fine. Doesn't look like they come with clips usually.",1630736452.0,2021-09-04 02:20:52
DWhy The Cathode Is Put On The Shoulder?,1,ph79dk,tDCS,https://www.reddit.com/r/tDCS/comments/ph79dk/dwhy_the_cathode_is_put_on_the_shoulder/,7,"I want to start experimenting with different areas on my head.

You place the anode where you want MORE stimulation. And cathode goes where you want less stimulation.

So why does it go on the shoulder on some placements?

How do you choose which shoulder to put the cathode on?

Also, can you put it somewhere else? Like on your chin or something. 

The shoulder is really inconvenient as you have to take off clothing to access it.

Thanks guys :)",1630682378.0,2021-09-03 11:19:38
CES Sparks (Conduction Issue),6,peq2ju,tDCS,https://www.reddit.com/r/tDCS/comments/peq2ju/ces_sparks_conduction_issue/,9,"Hiya! 

I have a CES device that I bought to help relieve my anxiety. So far, no good. 

When I use the unit (sponge-clips to ear lobes) they have a mild zapping sensation. I can't ""dial down"" the unit any lower. (It's at 1 of 6). I understand it should be just sub perceptual for efficacy. 

I've tried a few conductive substances, and the best so far has been contact lens saline solution. But it's not enough. 

I'd really like this to work as building my vagus tone seems the last step in a very long health journey. 

I'd be quite grateful for ideas. Thanks!

EDIT: This thread can be summarised as : ""ATANG and YJT CES machines are not worth buying. At least for me."" 


FYI

- The clips have sponge on one side and none on the other.

- This is a ""cheap Chinese"" product found on Amazon. I'm more thinking it's the sponge than the device. 

- I didn't try electrode Gel yet as it's not easy to find; delivery will take 10 days (!)

- I have noticed effects on my system, but stimulating not relaxing. Which is an ok start; at least it's seemingly effecting vagus (or whatever). Direction of effect can be tweaked, I'm sure. 

- I also just received a tDCS (Apex) & may have to shift there although montage location seems...a lot of precision work.",1630354200.0,2021-08-30 16:10:00
best alpha stim in the 200 ish dollar range,4,pe4hpi,tDCS,https://www.reddit.com/r/tDCS/comments/pe4hpi/best_alpha_stim_in_the_200_ish_dollar_range/,5,"i can't really tell the difference between all the models being offered so i would like some advice.

&#x200B;

edit i'm thinking of getting the zen of sleep one",1630273561.0,2021-08-29 17:46:01
Tdcs specific montage anode fp1 and cathode fp2,7,pdrd8f,tDCS,https://www.reddit.com/r/tDCS/comments/pdrd8f/tdcs_specific_montage_anode_fp1_and_cathode_fp2/,2,"My son with autism is prescribed tdcs with anode as fp1 and cathode on fp2.   
please share experience and related information",1630224649.0,2021-08-29 04:10:49
tdcs montage for stress?,5,pcayfh,tDCS,https://www.reddit.com/r/tDCS/comments/pcayfh/tdcs_montage_for_stress/,1,"&#x200B;

Hi.

I have read some studies and observed two setups with positive effects, the first is anode F3 and cathode Fp2 , the second is anode left DLPFC and cathode right DLPFC. What montage is recommend for stress?

&#x200B;

Thanks.",1630019604.0,2021-08-26 19:13:24
PARTICIPANTS WANTED: DIY tDCS Research Study,15,pbeg2t,tDCS,https://www.reddit.com/r/tDCS/comments/pbeg2t/participants_wanted_diy_tdcs_research_study/,3,"Hello,

I am a doctoral candidate in clinical psychology at Duquesne University writing my dissertation on attitudes towards cognitive enhancement and the experiences of individuals who use do-it-yourself transcranial direct current stimulation (tDCS). I am looking for individuals who would be interested in participating in an approximately 60 minute interview via Skype or Zoom for the purposes of a qualitative research study. The interview will focus on the personal meanings and contexts surrounding your use of these devices, as well as how it influences the way that you understand yourself and the world around you.In order to participate, you must be at least 18 years old and must own a tDCS device that is either self-built or purchased from a direct-to-consumer manufacturer. For more information, send me a message on here or contact...

Erick Guzman, M.A.  
Doctoral Candidate – Clinical Psychology  
Duquesne University  
[guzmane@duq.edu](mailto:guzmane@duq.edu)",1629907918.0,2021-08-25 12:11:58
How is the Fisher Wallace device different from tDCS?,3,p9hfcm,tDCS,https://www.reddit.com/r/tDCS/comments/p9hfcm/how_is_the_fisher_wallace_device_different_from/,8,,1629655364.0,2021-08-22 14:02:44
Place to Buy in Australia?,5,p99kf6,tDCS,https://www.reddit.com/r/tDCS/comments/p99kf6/place_to_buy_in_australia/,2,Have only just discovered the existence of these devices after searching a long time for something for anxiety help and wanting away from medications if at all possible. Now though I can't seem to find any legitimate websites that have any of these for sale in Australia. Does anyone know of somewhere?,1629624863.0,2021-08-22 05:34:23
Sponge electrodes & scalp burns,6,p9734r,tDCS,https://www.reddit.com/r/tDCS/comments/p9734r/sponge_electrodes_scalp_burns/,19,"Hi all, I am using the TDCS depression montage and I have noticed lifting of my 20 year depression with this in a way I have not noticed from other treatments. I would like to continue with TDCS.

However, I noticed that I have given myself some scalp burns both times I have done the depression montage. The burns don’t appear to be on my forehead but only on the scalp. 

I am using the Apex 2 mA device with sponge electrodes for 20 min sessions at 2 mA.

The first time, I was using 0.9% saline solution, but I felt that it was too painful so I stopped.

This time I cut the 0.9% saline with tap water in a 2:1 ratio. I felt some pain as I was turning up the device at the session was start, but then I only felt itching during the rest of the session, and then felt some pain as I was turning down the device at the session end. I noticed that I had the same red bumps in my hair and now it feels like scabs, as before.

How do I do TDCS without burning my scalp? 

From one article I read, I’m not sure if my electrodes were wet enough. How wet should they be?

How do you guys make your saline?

Since it didn’t burn my forehead—is the fact that I have long hair a problem? Not willing to shave my head, but also feel like I need TDCS to improve my depression.",1629611467.0,2021-08-22 01:51:07
"F7-Fc1 montage, which was shown by a recent big study to be helpful for working memory (see my previous post here, some people asked for how the montage looks)",22,p8rzls,tDCS,https://i.redd.it/6jnm1lqkwpi71.png,22,,1629554537.0,2021-08-21 10:02:17
After all these years tdcs finally sees some light at the end of the tunnel all for it to see such awful representation.,6,p8pmvw,tDCS,https://www.reddit.com/r/tDCS/comments/p8pmvw/after_all_these_years_tdcs_finally_sees_some/,3,https://youtu.be/17NE08J7U00,1629544361.0,2021-08-21 07:12:41
DARPA: Why is one electrode on the shoulder?,4,p859cf,tDCS,https://www.reddit.com/r/tDCS/comments/p859cf/darpa_why_is_one_electrode_on_the_shoulder/,4,Is it because the stimulation should travel through as much of the brain tissue as possible?  Since the other one is placed in front on the other side?,1629466314.0,2021-08-20 09:31:54
Immediate effects??,2,p7tr2o,tDCS,https://www.reddit.com/r/tDCS/comments/p7tr2o/immediate_effects/,4,"Hello. I am new to tdcs, but I am very interested.

Is there any immediate effect after receiving a first and only stimulation (Approx. 15/20 min)? Or what feeling have you had after stimulation?",1629428594.0,2021-08-19 23:03:14
stimulation limits for various needs,3,p7rbn1,tDCS,https://www.reddit.com/r/tDCS/comments/p7rbn1/stimulation_limits_for_various_needs/,19,"Let's say a person primarily wants to treat depression, but also suffers from chronic pain and wants to improve working memory.  

These are different montages.  Can the person do 3 stimulations on the same day for different things?  What to do to stimulate different needs?",1629419456.0,2021-08-19 20:30:56
"A new large scale study, summarizing 87 experimental studies has identified the best region to be stimulated by tDCS for improving working memory. They found that the lower dorsolateral prefrontal cortex was the best target location, with a F7 (anode) - Fc1 (cathode) montage.",29,p7nipu,tDCS,https://doi.org/10.1016/j.neubiorev.2021.08.017,15,,1629406731.0,2021-08-19 16:58:51
Sponges for Bumble Bee Neuron Queen CES,4,p7b3ve,tDCS,https://www.reddit.com/r/tDCS/comments/p7b3ve/sponges_for_bumble_bee_neuron_queen_ces/,3,"Hi,

I recently got a CES device (Bumble Bee Neuron Queen) but it only includes the stick on electrodes. I'm looking for sponges or something similar that I can use for montages in spots over my hair and I have a hard time finding any with the right connector for the device. The montage I want to do is for accelerated muscle memory for learning instruments.

Any info much appreciated :)",1629363329.0,2021-08-19 04:55:29
"Tried the Montage for sleep and for the first time in years, I had a decent night's sleep.",11,p6yovr,tDCS,https://www.reddit.com/r/tDCS/comments/p6yovr/tried_the_montage_for_sleep_and_for_the_first/,7,"Tools used BrainDriver and Apple Watch with Pillow app

Sleep quality has improved by 20% and overage time asleep by around 1 hour.

[https://thebraindriver.com/pages/tdcs-for-improved-sleep](https://thebraindriver.com/pages/tdcs-for-improved-sleep)

Updated Post: Changed Montage and more data points",1629316056.0,2021-08-18 15:47:36
Reaction time,2,p6tgz2,tDCS,https://www.reddit.com/r/tDCS/comments/p6tgz2/reaction_time/,3,"Can anyone recommend a montage that increases reaction times for sports, video games, etc?

&#x200B;

Thanks!",1629300531.0,2021-08-18 11:28:51
Dramatically different regime between tDCS and tACS,4,p582jr,tDCS,https://www.reddit.com/r/tDCS/comments/p582jr/dramatically_different_regime_between_tdcs_and/,2,"I've been experimenting with a few different CES devices, and have notices a pretty dramatic differences in settings between tDCS and tACS.  Has anyone noticed similar?

A particularly interesting difference is that tACS devices are easier to tolerate at higher currents. I have a custom circuit I can get to 8mA personally, and have never had anyone tap out at 5mA on a tACS devices.  With my tDCS circuit and tDCS devices, most people start reporting round 3mA, and stop around 4.5mA.  All are using cellulose electrodes.

On the flip side, there's a lot more sub threshold feel to tACS, even under 2mA I've gotten consistent reports of vibrating or pulsing, usually around the frequency of the stimulation, even fully grounded.  tDCS also seems to have a stronger effect.  The Left Front, Bottom Right stimulation rotation seems to have a much stronger effect under tDCS compared to tACS.

Is this consistent with what others are finding?",1629084501.0,2021-08-15 23:28:21
"DARPA, Attaching electrode to shoulder",3,p4tayo,tDCS,https://www.reddit.com/r/tDCS/comments/p4tayo/darpa_attaching_electrode_to_shoulder/,3,"I am new to tdcs. I purchased activadose unit. I am looking to improve focus and retention. Seems like DARPA montage for accelerated learning is a good place to start. For F10, seems simple to place, anode, right temple. I can keep the electrode(sponge) in place with headband. What is the best way to keep the left shoulder electrode in place? I was thinking to tape it in place with non conductive tape(ie electrical tape). What have others used?",1629033694.0,2021-08-15 09:21:34
Do any reputable tDCS researchers back any of the commercially available devices?,5,p4ju2u,tDCS,https://www.reddit.com/r/tDCS/comments/p4ju2u/do_any_reputable_tdcs_researchers_back_any_of_the/,16,"There does seem to some high quality research on tDCS but I’m skeptical you can reproduce those effects on the commercial available devices (DIY health treatment is very susceptible to the placebo effect). So I’m curious if anyone knows any published researchers in the field who back any of these devices and or specifies what kind of techniques or training you would need to make them work? 

I was also curious if anyone knows which device the Langone NYU clinic uses for its patients.",1628988851.0,2021-08-14 20:54:11
Do tacs Devices require FDA clearance ?,4,p4avhz,tDCS,https://www.reddit.com/r/tDCS/comments/p4avhz/do_tacs_devices_require_fda_clearance/,3,"I'm looking to try a tacs device and noticed some of them have FDA clearance (Fisher Wallace site says  ""To visit this medical website please confirm you are at least 21 years of age"", others say nothing at all. Do they need an FDA (or CES for Europe) ?",1628957538.0,2021-08-14 12:12:18
TRNS device treatment,6,p3mkz0,tDCS,https://www.reddit.com/r/tDCS/comments/p3mkz0/trns_device_treatment/,3,"does anybody know places that administer transcranial random noise stimulation (TRNS)? And not Transcranial direct current stimulation (TDCS) because I found that at NYU Langone health and  John Hopkins but I do not think they administer TRNS. Preferably in the New York, New Jersey, Pennsylvania area.",1628867176.0,2021-08-13 11:06:16
Is there a free and easy to use software for tdCS protocol visualization?,2,p3lt2y,tDCS,https://www.reddit.com/r/tDCS/comments/p3lt2y/is_there_a_free_and_easy_to_use_software_for_tdcs/,8,"Hello guys,

I see in some articles, they visualize which part of the brain is stimulated with tDCS? They put a picture of a brain indicating with green and red colors. What is that software exactly? Do I have to save an stimulation or just protocol values would be enough for it, like by entering the values?

Thanks in advance.",1628855456.0,2021-08-13 07:50:56
Learning motor skills (athletic goals),5,p3bnt4,tDCS,https://www.reddit.com/r/tDCS/comments/p3bnt4/learning_motor_skills_athletic_goals/,11,"Are there best placement or session parameter for learning fine motor skills?  Has anyone published this information?

Has anyone replicated the results shown on RadioLab episode, 9 Volt Nirvana?",1628811353.0,2021-08-12 19:35:53
LSD + tDCS?,13,p1lyje,tDCS,https://www.reddit.com/r/tDCS/comments/p1lyje/lsd_tdcs/,15,"Hi,
has anyone tried TDCS(20 min, 2mA) while microdose LSD?
Thank in advance.",1628588655.0,2021-08-10 05:44:15
How long should a battery last per braindriver session,3,p0rwol,tDCS,https://www.reddit.com/r/tDCS/comments/p0rwol/how_long_should_a_battery_last_per_braindriver/,2,"Noob question, I just got my braindriver and it is eating batteries. A Duracell lasted one session before draining. How long should they last and could it be me doing something wrong?

The protocol being used.

* 1/2 teaspoon of Sea Salt(non-iozinzed) in 250ml  very soft water.
* Sponges and electrodes soaked in above solution for 20 seconds
* 10 minutes session at 0.5 results in some redness on skin and pain and stinging that is 2 out of 10.
* Sponges and Electrodes are rinsed in clear water to reduce salt water build-up in sponges.

Another question,  I have is how often should I change the sponges?

&#x200B;

Edit: I live in an area with very soft and clean tap water by reducing the amount of salt, I reduced the draining time of the battery and also reducing the pain and stinging I felt during the session.

&#x200B;",1628474226.0,2021-08-08 21:57:06
foc.us Go Flow - current won't go to 2mA,9,oydwv7,tDCS,https://www.reddit.com/r/tDCS/comments/oydwv7/focus_go_flow_current_wont_go_to_2ma/,6,"Hi I've been using [foc.us](https://foc.us) Go Flow device for quite some time, with sponge electrodes.

Sometimes I have the following problem: the current won't go to 2mA despite setting it so. It starts increasing but stops somewhere in between, like at 1.25 or 1.0. Recently went up to 2mA but then dropped to 1.0 and stayed this way for 20 minutes. 

I cannot pinpoint the reason, tried adding more salt, adjusting the electrodes, different cable, fresh battery.

It's intermittent, sometimes in a different session it goes to 2mA and stays for 20 mins...

Any thoughts?",1628155354.0,2021-08-05 05:22:34
"popularity, learning and TDCS",6,oy2ary,tDCS,https://www.reddit.com/r/tDCS/comments/oy2ary/popularity_learning_and_tdcs/,9," 
Q1)  Does TDCS provide any real effects with learning ability and mathmatical ability?

**Context:** I ask because TDCS is really cheap and so I would expect alot of people (espically students and biohackers) to adopt this type of technology. 


Q2) Why is TDCS not popular?

**Context:** Seems it had alot of attention in 2013-2017 but it's kinda died down and the internet does not seem to give it much attention either with lack of communties for it. There is barley nothing on youtube and reddit seems like the most active forums for TDCS. 


Q3) Is TDCS a SCAM? 

**Context:** TDCS seems to have alot of people saying the effects are not replicable and it seems to just work in some people and not work in others.

Any testomonies are welcome!",1628110988.0,2021-08-04 17:03:08
Does the BrainDriver require a consistent 9V input?,3,oxi61o,tDCS,https://www.reddit.com/r/tDCS/comments/oxi61o/does_the_braindriver_require_a_consistent_9v_input/,3,"Trying to decide what kind of rechargeable batteries to pickup. Lithium would be preferred, but output appears to be 8.4V, not 9V. 

Does anybody know if the BrainDriver can be used with a 9V battery that is outputting less than 9V?

Edit: Lithium 9V batteries work fine. BrainDriver will show the 9V battery is discharged (half full) because the battery meter is based upon voltage. However, it still takes a long time to drain the battery.",1628041431.0,2021-08-03 21:43:51
"When stimulating FZ for the impulse control protocol, why is the cathode on the left cheek? Does it really matter?",8,owq1i3,tDCS,https://www.reddit.com/r/tDCS/comments/owq1i3/when_stimulating_fz_for_the_impulse_control/,2,Could I just put the cathode on the shoulder?,1627944943.0,2021-08-02 18:55:43
Questions about Bipolar and Frequency of use,5,ovxtaa,tDCS,https://www.reddit.com/r/tDCS/comments/ovxtaa/questions_about_bipolar_and_frequency_of_use/,7,"Hello Reditters, I was having trouble understanding the answers to these questions, so I thought I would reach out to the community.

1) How long do effects last, does this become a daily morning practice?

2) I am Bipolar Hypomanic on 75mg of Lamictal. Am I crazy for thinking of trying tdcs? Anyone else?",1627843644.0,2021-08-01 14:47:24
How has TDCS helped you,9,ovnkjz,tDCS,https://www.reddit.com/r/tDCS/comments/ovnkjz/how_has_tdcs_helped_you/,6,How has TDCS helped you and what have been your favorite montages?,1627801428.0,2021-08-01 03:03:48
Chlorine smell from one electrode on my flow tdcs device. Dangerous?,7,ouvsp5,tDCS,https://www.reddit.com/r/tDCS/comments/ouvsp5/chlorine_smell_from_one_electrode_on_my_flow_tdcs/,4,There's a noticeable chlorine smell from one side only when I finish a 30 min session. I read something about chlorine gas forming at the anode and it is true that I get a bit more itchiness and redness on that side after. Is it dangerous?,1627685592.0,2021-07-30 18:53:12
TENS device unexpected multimeter readings,6,otglbs,tDCS,https://www.reddit.com/r/tDCS/comments/otglbs/tens_device_unexpected_multimeter_readings/,16,"New to TENS and know nothing about electricity. 

Device spec. sheet lists current range from 1-80 mA. When hooked up to a multimeter, the max output I seem to be able to achieve is just south of 1.5 mA. 

1. I touched the multimeter probes directly to the metal pluggy bits on the TENS device.
2. I measured mA in AC mode as the internet said this was the type of current generated. DC reads even lower.
3. Device is the Ultima 3t powered by 4 x AAA batteries.
4. Device has three modes. None read higher than 1.5 mA.

What gives?",1627499020.0,2021-07-28 15:03:40
TENS or EMS for tVNS?,7,oswwwb,tDCS,https://www.reddit.com/r/tDCS/comments/oswwwb/tens_or_ems_for_tvns/,22,"Hi, I’m trying to start ear vagus nerve stimulation at home, but I was hoping more experienced people could give me advice. Should I use TENS and/or EMS? Some devices do both currents. 

Any other general advice? I’ve heard that it’s safest to just do the left ear. As for power and duration, im not sure but I heard there are YouTube videos about that.

Thank you!",1627425280.0,2021-07-27 18:34:40
"Any idea on, tDCS 2 times a day, with different montages each time - Posting again to get more attention",6,osq54j,tDCS,/r/tDCS/comments/ooc0j4/any_idea_on_tdcs_2_times_a_day_with_different/,6,,1627403106.0,2021-07-27 12:25:06
Cain i use LIFTiD TDCS to stimulate my anodal F3 and cathodal Fp2?,0,osof4o,tDCS,https://www.reddit.com/r/tDCS/comments/osof4o/cain_i_use_liftid_tdcs_to_stimulate_my_anodal_f3/,1,"Hello
I know LIFTiD TDCS has a fixed montage of anodal F3 and cathodal F4. But I wanted a seamless experience of stimulating my anodal F3 and cathodal Fp2. 

Is it doable, safe and effective?",1627397761.0,2021-07-27 10:56:01
Desperate for relief: who has tried this montage and what results have you achieved?,2,osammo,tDCS,https://www.reddit.com/r/tDCS/comments/osammo/desperate_for_relief_who_has_tried_this_montage/,7,"[https://apexdevice.net/tdcs-montage-depression-pain-organization-skills/](https://apexdevice.net/tdcs-montage-depression-pain-organization-skills/)

I am particularly interested in pain, as I have been in chronic pain for quite some time and it drains my energy level (it is related to a disability I have had since birth), however, I would also like to know about any results with the other two potential effects: relieving depression and improving organization skills. I would appreciate all feedback. Just to give some background on what my current regimen is and has been in the past, I have primarily used the ""classic"" anxiety and depression montage (cathode right above the right eye \[phosphene inducer!\]) and anode higher up on the forehead on the left side.",1627341212.0,2021-07-26 19:13:32
TheBrainDriver. Placements I can try for faster word recall? Working memory?,10,os39l8,tDCS,https://www.reddit.com/r/tDCS/comments/os39l8/thebraindriver_placements_i_can_try_for_faster/,10,"New group member question. 
For the past year I've been using TheBrainDriver tDCS products in the DARPA mode for physical performance. It has helped me immensely and I'm happy with my results here.

My question is: Is there a good electrode placement for fast/enhanced word recall (or maybe working memory stimulation) ? 

Thanks in advance to the group!",1627319538.0,2021-07-26 13:12:18
