title,score,id,subreddit,url,num_comments,body,created,datetime
which tDCS devices are the best ones right now?,17,qjnajr,tDCS,https://www.reddit.com/r/tDCS/comments/qjnajr/which_tdcs_devices_are_the_best_ones_right_now/,17,"Hey. I’m currently treated for treatment resistant depression and social anxiety with Parnate (MAOI antidepressant) and the results are great so far but I feel like I’m not 100% in remission and did some research about tDCS and would like to try my luck with it as an adjunct to my medication before going on higher doses.

Im looking for a high quality brand that is available in the market and not super complex to use for a newbie. Price is secondary, I’d rather pay more for my health‘s safety. Any recommendations are appreciated.",1635678340.0,2021-10-31 07:05:40
Protocols for better auditory processing for musicians,10,qimlw2,tDCS,https://www.reddit.com/r/tDCS/comments/qimlw2/protocols_for_better_auditory_processing_for/,1,"Any musicians out here have protocols or have done experiments to improve your ear when listening to music? I'm mainly looking for protocols for CES to improve my ear, but tDCS is also appreciated.

Any other protocols that helps develop muscle memory related to instruments are also appreciated.",1635542200.0,2021-10-29 17:16:40
Hi! Any recommendations for a cheap t/dcs machine?,4,qgm2mt,tDCS,https://www.reddit.com/r/tDCS/comments/qgm2mt/hi_any_recommendations_for_a_cheap_tdcs_machine/,6,Need it for a research experiment.,1635300483.0,2021-10-26 22:08:03
Learn how Pulsed Electromagnetic Field (PEMF) therapy helps in rapid recovery from Stroke & how stroke survivors can utilize PEMF therapy for stroke rehabilitation. It's easily one of the most effective neuro-rehabilitation technologies that can be used by anyone looking to improve their neuro-motor,6,qg53bj,tDCS,https://medium.com/@PEMFTherapy/stroke-rehabilitation-using-pemf-therapy-fdc41734350a,0,,1635250513.0,2021-10-26 08:15:13
Is there a montage that would help someone with ADD switch from the default mode network to the task positive network?,11,qdjege,tDCS,https://www.reddit.com/r/tDCS/comments/qdjege/is_there_a_montage_that_would_help_someone_with/,11,"Is there a montage that would help someone with ADD switch from the default mode network to the task positive network?

My understanding is the failure to switch off the default mode network when trying to concentrate is one of the major stumbling blocks for people with ADD. 

https://en.m.wikipedia.org/wiki/Default_mode_network",1634916643.0,2021-10-22 11:30:43
"Alpha Stim, chronic pain, and anxiety",1,qdcqbj,tDCS,https://www.reddit.com/r/tDCS/comments/qdcqbj/alpha_stim_chronic_pain_and_anxiety/,5,"I have questions for others who have tried using the Alpha Stim for pain relief. I also have questions related to anxiety. 

Did it/does it help your pain?

How long did it take you to feel improvement?

Did it/does it increase your anxiety?

If so, did you have to adjust any meds you were on?

I’ve started using mine for chronic back pain, and haven’t really felt any relief. It’s been about two months. 

I’ll use the 4 electrodes, set the machine to its highest setting, and go about my day. I don’t mind wearing it, so sometimes it’ll be on for 10+ hours. 

Then I’d usually do an ear-clip session afterwards. I can’t handle that one very high, only about a 1. Otherwise I’m nauseous, seasick and have a headache. 

I’ve noticed a huge increase in anxiety. 

My naturopath says that if you have trauma (oh boy do I ever- it’s being treated with EMDR and I’ve had a lot of success) that it’ll be like peeling an onion- trauma and feelings will come up while using it. And that if your anxiety increases, you probably have too much medication in your system. 

So, WTF do I do? I feel like the Alpha Stim has shown me a Costco sized warehouse of shitty feelings I’ve crammed into my body over the last 40 years that need to be let out and I’m very overwhelmed. And still in pain. 

My anxiety was so well controlled with my SSRI up until now. Do I go off of it? That’s a serious undertaking. I have an appointment with my psychiatrist in a few weeks and I’ll be asking her. 

If this is what Alpha Stim is like while taking an SSRI I might not be able to handle it. 

I just really really really don’t want to be in such constant pain. I also REALLY don’t want to take opiates. 

I can’t get my pain dr to take me seriously. My ortho won’t take me seriously until the pain dr does. I’ve done PT, and it made it SO MUCH WORSE. I have some MRI’s waiting to get approved but I’m guessing they won’t help much. 

I know this is probably trapped trauma in my body. Another reason Alpha Stim is a good choice for this particular pain. But I can’t function like this.",1634892803.0,2021-10-22 04:53:23
Do you want to stop stuttering : this might help !,16,qcqanv,tDCS,https://www.reddit.com/r/tDCS/comments/qcqanv/do_you_want_to_stop_stuttering_this_might_help/,7,"# I've seen a couple studies so far that look at the effects of tdcs on stuttering, I thought I would post them here.

**1)** Transcranial direct current stimulation over left inferior frontal cortex improves speech fluency in adults who stutter: [https://www.ncbi.nlm.nih.gov/pmc/articles/PMC6019054/](https://www.ncbi.nlm.nih.gov/pmc/articles/PMC6019054/)

This study used **1ma for 20 minutes, anode over the left inferior frontal cortex FC5 and the cathode on the right supraorbital area**, while people did **choral and metronome-timed speech** (this was done for **5 days** and resulted in significant improvement in speech fluency compared to the group that just did the vocal training alone).

**2)** The Effectiveness of Transcranial Direct Current Stimulation (tDCS) on the Anxiety and Severity of Stuttering in Adolescents Aged 15 to 18: [http://jrrs.mui.ac.ir/index.php/jrrs/article/view/3605](http://jrrs.mui.ac.ir/index.php/jrrs/article/view/3605)

**2ma 20 minutes anode between F7 and FC5 and cathode between F8 and FC6** (in the article they wrote anterior temporal lobe, but not the location), for 10 sessions.

Results show a decrease in anxiety and in stuttering in the tdcs group.

**3)** The Effectiveness of Transcranial Direct Current Stimulation (tDCS) on Improving the Severity of Stuttering and Anxiety in School-aged Children Who Stutter: [https://jpcp.uswr.ac.ir/article-1-747-en.pdf](https://jpcp.uswr.ac.ir/article-1-747-en.pdf)

**1ma 20 minutes, anode F7** (left inferior frontal cortex), **cathode FP2** (right supraorbital) in **15 consecutive daily sessions**.

There was a decrease in stutter and in anxiety that was maintained at the follow up 6 weeks later.

**4)** Investigation of the effect of Delayed Auditory Feedback and transcranial Direct Current Stimulation (DAF-tDCS) treatment for the enhancement of speech fluency in adults who stutter: a Randomized Controlled Trial: [https://assets.researchsquare.com/files/rs-29391/v2/943060ea-c7e5-4202-b13a-cd9a6781fffb.pdf?c=1634299998](https://assets.researchsquare.com/files/rs-29391/v2/943060ea-c7e5-4202-b13a-cd9a6781fffb.pdf?c=1634299998)

**1ma 20 minutes, anode T3, cathode FP2** (right supraorbital) for **6 sessions** while doing DAF.

There was a reduction in the Stuttering Severity Instrument in the group that did the tdcs+DAF but not the group that just did the DAF. This effect persisted for the follow up 6 weeks later.

**5)** Online cathodal transcranial direct current stimulation to the right homologue of Broca's area improves speech fluency in people who stutter: [https://onlinelibrary.wiley.com/doi/full/10.1111/pcn.12796](https://onlinelibrary.wiley.com/doi/full/10.1111/pcn.12796)

**2ma 200 seconds, cathode between F8 and FC6** (between the temple and the ear), and anode left supraorbital improved speech fluency.

# 

Note that a lot of of the studies used 1ma and not 2ma, which is probably because the skulls of children are smaller and so, smaller currents are used. If you are an adult 2ma would probably be more effective.

Also, some montages also decreased anxiety, but it is not clear wether it is the montage in itself that has an anxiolytic effect or if people are less anxious because they stutter less.

In general, language is lateralized to the left part of the brain so that's where you want to put the anode. Two main areas are important for language production and processing (the Broca area, F7 or F5, and the Wernicke area CP5), and when stimulated they tend to increase verbal ability and fluency. The ideal is to speak during the stimulation to enhance the effects.

The cathode is often put on the right supraorbital, it might be more interesting to put it on F8 (the homologue of Broca's area but on the right side), since doing that in itself improves verbal fluency.

Speak to you soon :) (without a stutter I hope)",1634818070.0,2021-10-21 08:07:50
"YouTube channel on tDCS/tACS research, Yes or No?",14,qcbil1,tDCS,https://www.reddit.com/r/tDCS/comments/qcbil1/youtube_channel_on_tdcstacs_research_yes_or_no/,3,"I have been strolling around this subreddit for a while now, giving some occassional advice or joining a discussion. During that time I noticed there are two kinds of brain stimmers: 1. people who base their tDCS/tACS on research papers, with maybe some tweaks here or there. 2. people who think that research is limited and that self-experimentation on different parameters and montages is the way to go.

Now, I am a neuroscience researcher in the field of tDCS, tACS and TMS for the better part of 10 years now, so I would put myself into category 1. So, I was thinking about starting a YouTube channel, where we could discuss the research behind brain stimulation. Regular live discussions, Q n A's, and more lecture type streams on various topics related to brain stim research. But I would only do that if there is some interest. If y'all think: piss off with your research, I wouldn't do it :P

So, if you like, answer the following question. Do you base your session more on research or self-experimentation and would you be interested in a YT channel on tDCS/tACS research?

[View Poll](https://www.reddit.com/poll/qcbil1)",1634765472.0,2021-10-20 17:31:12
Advanced placement caps,2,qc3lp4,tDCS,https://www.reddit.com/r/tDCS/comments/qc3lp4/advanced_placement_caps/,6,"Does anyone have any recommendations on caps for electrode placements that don't lend themselves to simply being held on by a headband?  It seems like all the EEG-style caps on the internet aren't sold to consumers.

Alternately, has anyone simply tried making their own by customizing a swim cap or something?",1634744080.0,2021-10-20 11:34:40
New montage to increase creativity: tDCS of the Generation-Related Posterior Temporal Lobe and the Executive Control-Related Prefrontal Cortex,9,qc1fab,tDCS,https://www.reddit.com/r/tDCS/comments/qc1fab/new_montage_to_increase_creativity_tdcs_of_the/,11,"[https://academic.oup.com/cercor/advance-article-abstract/doi/10.1093/cercor/bhab261/6347937](https://academic.oup.com/cercor/advance-article-abstract/doi/10.1093/cercor/bhab261/6347937)

Abstract:

Creativity is generally defined as the ability to generate innovative thoughts that are both original and valuable. Previous studies have suggested that the temporal lobe, related to memory extraction and construction, is responsible for generating creative ideas and that the executive system supports the generation of creative ideas. However, the causal relationships between these structures and the novelty index as well as the appropriateness index of generated ideas have not been revealed. It is still largely unknown where and how original and valuable ideas are generated. In this study, the transcranial direct current stimulation technique was used to selectively manipulate the activity of the generation-related right temporoparietal junction (TPJ) (experiment 1) and the executive control-related left dorsolateral prefrontal cortex (DLPFC) (experiment 2). Then, both the novelty and appropriateness indexes of generated ideas were analyzed during insight problem-solving. The results showed that anodal stimulation of the right TPJ increased both the novelty and appropriateness indexes of creative ideas, whereas anodal stimulation of the left DLPFC increased the novelty index but not the appropriateness index of creative ideas. These findings suggest that the posterior temporal lobe takes both the novelty and appropriateness attributes into account to generate ideas, while the executive control system can effectively regulate the novelty attribute of generated ideas but ineffectively addresses the inappropriateness attribute. The current study indicates complementary mechanisms in the process of generating original and valuable ideas.",1634738078.0,2021-10-20 09:54:38
tDCS allowed?,0,q9q9zy,tDCS,https://i.redd.it/hbunysd0dxt71.png,1,,1634439081.0,2021-10-16 22:51:21
tDCS vs TMS vs ?? for Brain Fog— newbie question!,3,q9l5bf,tDCS,https://www.reddit.com/r/tDCS/comments/q9l5bf/tdcs_vs_tms_vs_for_brain_fog_newbie_question/,9,"Hi all! I posted in r/rTMS and r/BrainFog similar questions, but upon discovery of tDCS I saw there’s a much larger community here. I’m strongly considering starting a round of TMS, but have recently been spooked by possible side effects that aren’t mentioned in the general marketing of the treatment. Ive heard good things about tDCS, but how does it really compare in terms of efficacy and safety?

I’ve been diagnosed with depression, although personally I think 15 years of brain fog with no answers *led* to depression, not the other way around. But I also feel like I gave it an honest shot at treatment after years of therapy and various medications. It really does feel like if I could just give my brain a massage then this would all go away. But it sounds like this stuff is still largely experimental? How easy is it to hurt myself if I don’t know what I’m doing?

Thanks!",1634420145.0,2021-10-16 17:35:45
What prompted you to get a tDCS and/or tACS device?,6,q8qoqp,tDCS,https://www.reddit.com/r/tDCS/comments/q8qoqp/what_prompted_you_to_get_a_tdcs_andor_tacs_device/,3,"Silly question time: 

What prompted you to get a tDCS and/or tACS device? 

And has it worked? 

Thanks for your responses. I’m considering this as an option for depression.",1634311306.0,2021-10-15 11:21:46
Am I doing DualNback wrongly?,2,q8acgy,tDCS,https://www.reddit.com/r/tDCS/comments/q8acgy/am_i_doing_dualnback_wrongly/,5,"for example, dual3back auditory

ARHARQ -> I draw the picture in my mind.
(first floor) ARH.
And I stack the second floor.
(second floor) ARQ

So, I only press A, R.",1634250963.0,2021-10-14 18:36:03
Please recommend equipment for tinnitus,5,q89gtv,tDCS,https://www.reddit.com/r/tDCS/comments/q89gtv/please_recommend_equipment_for_tinnitus/,5,"I have severe tinnitus in my left ear and a little in my right. I read studies saying tdcs help. If anyone has experience with it, please give me recommendations on what to buy",1634248322.0,2021-10-14 17:52:02
How can you trust this when placement is involved?,7,q7cb43,tDCS,https://www.reddit.com/r/tDCS/comments/q7cb43/how_can_you_trust_this_when_placement_is_involved/,5,"What I don't get is how do you get reliable placement info.

One of the most popular montages for example is mental insight. Which popular sites refer to a T4+, T3- configuration (i.e. L- R+):

[https://totaltdcs.com/electrode-placement-montage-list/improved-insight/](https://totaltdcs.com/electrode-placement-montage-list/improved-insight/)

[http://tdcsplacements.com/placements/improving-insightfulness/](http://tdcsplacements.com/placements/improving-insightfulness/)

&#x200B;

if you look at the study from 2011 that is cited by these pages:

[https://journals.plos.org/plosone/article?id=10.1371/journal.pone.0016655](https://journals.plos.org/plosone/article?id=10.1371/journal.pone.0016655)

&#x200B;

https://preview.redd.it/4a3prl5098t71.png?width=606&format=png&auto=webp&s=161d6ce5e7ae4eec70cd89f120fbaef4f54a461f

&#x200B;

They actually state the complete opposite: L+ R- has shown the most significant decrease in time required to complete the mental task.

Now I've seen quoting variation in my time in academia, but stating the complete opposite?! especially when polarity is involved??

Also, how does it make sense that reducing the excitability of the left brain (analytical hemisphere) is expected to cause an increase in mental problem-solving capacity?

Does anyone have a coherent explanation?",1634135165.0,2021-10-13 10:26:05
How to find P3 on the skull for mathematics ?,1,q75owu,tDCS,https://www.reddit.com/r/tDCS/comments/q75owu/how_to_find_p3_on_the_skull_for_mathematics/,2,"i want to get better at mathematics and I thought that I could use tdcs while I train for maths.

The studies that have investigated the effects of tdcs on math have only done it in relation the arithmetic learning (as far as I know), but since all mathematics utilize the same brain areas (which means that you use the same networks to do very simple math like counting and very complex math), I thought I could try the arithmetic montage, which stimulates P3 (or P4).

&#x200B;

But I have trouble finding it on my skull, since it is not like frontal areas where you can clearly see where what area is.

&#x200B;

Does anyone have any advice on how to find P3 ?",1634108697.0,2021-10-13 03:04:57
Any benefit of cathodal stimulation?,0,q72h7x,tDCS,https://www.reddit.com/r/tDCS/comments/q72h7x/any_benefit_of_cathodal_stimulation/,6,I was wondering if cathodal stimulation inhibits neural activity and doing a little research there doesn’t seem to be any significant results. So is it a good idea to just put the cathode on my left and/or right shoulder depending on the direction of the brain region I’d like to stimulate?,1634095415.0,2021-10-12 23:23:35
I wanna target a deep part of my brain called the DMN (Default Mode Network) which is located around 15cm below Pz.,2,q6wdxr,tDCS,https://www.reddit.com/r/tDCS/comments/q6wdxr/i_wanna_target_a_deep_part_of_my_brain_called_the/,5,"I have a tACS machine, should I place one electrode on Pz and the second on the left shoulder like DARPA or would the current distribution from Pz be too shattered then so that it's better to place the second electrode at the neck or under the shin to make the stimulation be as close to the area as possible?

(From what I understand it doesn't really matter where you place the anodal vs cathodal since it's bi-directional in tACS.)",1634074849.0,2021-10-12 17:40:49
"What are the effects of using earclips in tDCS/TACS? Using them instead of electrodes or as an addition, and why?",5,q6w6vm,tDCS,https://www.reddit.com/r/tDCS/comments/q6w6vm/what_are_the_effects_of_using_earclips_in/,1,,1634074256.0,2021-10-12 17:30:56
I'm new to this. Please help me.,1,q6lr32,tDCS,https://www.reddit.com/r/tDCS/comments/q6lr32/im_new_to_this_please_help_me/,2,"I can't find a guide here for tDCS for depression. What's a montage? I'm doing F3+/FP2- 2 times a day with 10 minutes each session. Is this okay. How long till I feel relief from depression? Also, do I have to clean the electrodes/ cloths after every use? How do I do this? Thanks .",1634043940.0,2021-10-12 09:05:40
Proper care for Electrodes and Sponges?,3,q5m1sp,tDCS,https://www.reddit.com/r/tDCS/comments/q5m1sp/proper_care_for_electrodes_and_sponges/,2,Is there something I should do with the electrodes and sponges afterward? I dipped them in saline water beforehand.,1633918576.0,2021-10-10 22:16:16
Fisher Wallace didn’t work…should I try Alpha stim?,3,q56y3w,tDCS,https://www.reddit.com/r/tDCS/comments/q56y3w/fisher_wallace_didnt_workshould_i_try_alpha_stim/,6,"Hey experts!  Years ago (probably 10-12) I bought the Fisher Wallace device when it first came out.  I was using it for anxiety and depression and didn’t notice any difference.

My health situation has dramatically declined (mostly bed and housebound with a variety of stuff), and the anxiety and depression has worsened.  

I recently heard about the Alpha Stim and would like to try it, but if it’s just the same thing as the FW…been there, done that. 

Are they different?  Thoughts??",1633868259.0,2021-10-10 08:17:39
How to use tDCS or tACS to lower the amplitude of a frequency?,4,q506t8,tDCS,https://www.reddit.com/r/tDCS/comments/q506t8/how_to_use_tdcs_or_tacs_to_lower_the_amplitude_of/,8,"So I'm very interested in this study where they saw that lowering the alpha activity of Default Mode Network (Right under Pz) through neurofeedback was really effective at achieving less mind wandering and mental chatter.

Is this something we can do with tDCS or tACS as well? Either by lowering the amplitude of all frequencies in DMN or a specific one like alpha?  
If it can I think this could be huge.

Here's the study: [https://www.sciencedirect.com/science/article/pii/S1053811912009561](https://www.sciencedirect.com/science/article/pii/S1053811912009561)  
And here's a video where the author talks about it, primarily in the second half: [https://www.youtube.com/watch?v=2zv2gBZMu9w&ab\_channel=CIBMCenterforBiomedicalImaging](https://www.youtube.com/watch?v=2zv2gBZMu9w&ab_channel=CIBMCenterforBiomedicalImaging)",1633836385.0,2021-10-09 23:26:25
5 sessions a day safe?,3,q4xxyh,tDCS,https://www.reddit.com/r/tDCS/comments/q4xxyh/5_sessions_a_day_safe/,4,"Is it safe to do 5 tDCS sessions a day (for about 15 - 20 min at 1.5 mA) assuming they are spaced out by about 90 - 120 minutes?

I will be using it for insight, memory/focus, learning, etc. from [https://www.tdcs.com/montage-guide](https://www.tdcs.com/montage-guide)",1633827331.0,2021-10-09 20:55:31
"Am I dumb? I can't find any concrete info about electrode placements for tACS, or what frequencies I should use. Please help if you have knowledge or experience.",2,q4x1x9,tDCS,https://www.reddit.com/r/tDCS/comments/q4x1x9/am_i_dumb_i_cant_find_any_concrete_info_about/,11,"Do people use the same placements that are used for tDCS? What frequencies are used? I've had great success using tDCS for clearing brain fog, and increasing executive function and I've had a small improvement in my ability to remember things. I don't want to diagnose myself, but a lot of the symptoms that get listed for ADHD resonate with me a lot, and tDCS has improved things a lot.

I'd like to try the AC setting on my device to see if it has any additional or different effects.

Thanks in advance.",1633823880.0,2021-10-09 19:58:00
Why did the Halo Sport or Focus Gamer fail?,1,q4ndvp,tDCS,https://www.reddit.com/r/tDCS/comments/q4ndvp/why_did_the_halo_sport_or_focus_gamer_fail/,2,Halo Spot seemed to have many tier 1 clients. Why did they go under?,1633792819.0,2021-10-09 11:20:19
"Transcranial direct current stimulation (tDCS) combined with cognitive training in adolescent boys with ADHD: a double-blind, randomised, sham-controlled trial",14,q4et3t,tDCS,https://www.cambridge.org/core/journals/psychological-medicine/article/transcranial-direct-current-stimulation-tdcs-combined-with-cognitive-training-in-adolescent-boys-with-adhd-a-doubleblind-randomised-shamcontrolled-trial/59D03EBDCF1A7297D5C8ED4A8F5CCE62,9,,1633756777.0,2021-10-09 01:19:37
Introductory Guide To tDCS?,4,q4du7g,tDCS,https://www.reddit.com/r/tDCS/comments/q4du7g/introductory_guide_to_tdcs/,9,"Is there an introductory guide to tDCS published anywhere on the internet?

The montage I am looking at calls for: 

>anode placed over the left dorsolateral prefrontal cortex (F3 for the international 10-20 system) and the cathode over the contro-lateral orbit.

I don't know what a contro-lateral orbit is. Moreover it calls for 2mA. Would it be sensible to start at a lower current if I've never done this before?",1633752421.0,2021-10-09 00:07:01
Alternative depression montages,4,q3lfm2,tDCS,https://www.reddit.com/r/tDCS/comments/q3lfm2/alternative_depression_montages/,6,"In my previous submission I mentioned the two main anti-depression montages: anodal F3 (red, left DLPFC) and cathodal FP2 (black, supraorbital), anodal F3 and cathodal F4 (right DLPFC). It seems that there are at least two others.

This study (tACS) saw positive results with anodal F3 and F4, and cathodal CZ. 

https://www.nature.com/articles/s41398-019-0439-0

And here Dr. Marom Biksom seems to be demonstrating a very high F3 and ~~T4~~ F8.

https://www.diytdcs.com/2016/03/tdcs-depression-montage/

Regarding the first study, how could I try it if the Bumblebee only comes with two electrodes?

EDIT: Upper right temple is F8, not T4.",1633649458.0,2021-10-07 19:30:58
Just had my first session and dont feel like myself,11,q27zzx,tDCS,https://www.reddit.com/r/tDCS/comments/q27zzx/just_had_my_first_session_and_dont_feel_like/,7,"Hi,
I just did my first session using a flow neuroscience headset and after a few hours I'm feeling very anxious and not really like myself. Maybe a bit emotionless? (besides anxiety) I want to know, is this stuff permanent? I'm scared its going to mess up my brain. And is it normal to feel bad at first?
Thanks",1633475412.0,2021-10-05 19:10:12
